<?xml version="1.0" encoding="UTF-8"?>
<!DOCTYPE list SYSTEM "multisell.dtd">
<!--AUTHOR: Bonux-->
<list>
	<config no_tax="true"/>
	<item>
		<production id="71437" count="1"/>	<!--Shining Jewel Box-->
		<ingredient id="71438" count="1"/>	<!--Jewel Coin-->
		<ingredient id="57" count="2000000"/>	<!--Adena-->
	</item>
	<item>
		<production id="90311" count="1"/>	<!--Brooch Lv. 1-->
		<ingredient id="71438" count="1"/>	<!--Jewel Coin-->
	</item>
	<item>
		<production id="90312" count="1"/>	<!--Brooch Lv. 2-->
		<ingredient id="71438" count="50"/>	<!--Jewel Coin-->
		<ingredient id="90311" count="1"/>	<!--Brooch Lv. 1-->
		<ingredient id="57" count="30000000"/>	<!--Adena-->
	</item>
</list>