<?xml version="1.0" encoding="UTF-8"?>
<!DOCTYPE list SYSTEM "multisell.dtd">
<!--AUTHOR: Bonux-->
<list>
	<item>
		<production id="45493" count="1"/>	<!--Fishing Rod Pack (1-day)-->
		<ingredient id="57" count="20514"/>	<!--Adena-->
	</item>
	<item>
		<production id="38154" count="1"/>	<!--Fishing Shot-->
		<ingredient id="57" count="28"/>	<!--Adena-->
	</item>
	<item>
		<production id="45495" count="1"/>	<!--Normal Bait-->
		<ingredient id="57" count="7"/>	<!--Adena-->
	</item>
</list>