<?xml version="1.0" encoding="UTF-8"?>
<!DOCTYPE list SYSTEM "multisell.dtd">
<list>
	<config type="CHANCED"/>
	<item>
		<production id="70295" count="1"/>	<!--Талисман Границы +2-->
		<production id="70295" count="1" chance="50"/>	<!--Талисман Границы +2-->
		<production id="70294" count="1" chance="50"/>	<!--Талисман Границы +1-->
		<ingredient id="70294" count="1"/>	<!--Талисман Границы +1-->
		<ingredient id="70294" count="1"/>	<!--Талисман Границы +1-->
	</item>
	<item>
		<production id="70296" count="1"/>	<!--Талисман Границы +3-->
		<production id="70296" count="1" chance="40"/>	<!--Талисман Границы +3-->
		<production id="70295" count="1" chance="60"/>	<!--Талисман Границы +2-->
		<ingredient id="70295" count="1"/>	<!--Талисман Границы +2-->
		<ingredient id="70295" count="1"/>	<!--Талисман Границы +2-->
	</item>
	<item>
		<production id="70297" count="1"/>	<!--Талисман Границы +4-->
		<production id="70297" count="1" chance="20"/>	<!--Талисман Границы +4-->
		<production id="70296" count="1" chance="80"/>	<!--Талисман Границы +3-->
		<ingredient id="70296" count="1"/>	<!--Талисман Границы +3-->
		<ingredient id="70296" count="1"/>	<!--Талисман Границы +3-->
	</item>
	<item>
		<production id="70298" count="1"/>	<!--Талисман Границы +5-->
		<production id="70298" count="1" chance="10"/>	<!--Талисман Границы +5-->
		<production id="70297" count="1" chance="90"/>	<!--Талисман Границы +4-->
		<ingredient id="70297" count="1"/>	<!--Талисман Границы +4-->
		<ingredient id="70297" count="1"/>	<!--Талисман Границы +4-->
	</item>
</list>